{
  "id": "wf-03",
  "name": "Booking Confirmation + Reminders",
  "job": "Confirm and remind booked appointments across the three consult calendars. Never marks a reschedule as no-show.",
  "trigger": {
    "type": "Appointment Booked",
    "filters": [
      "calendar 1Cfy5JnO2A4ggiZlMVvX",
      "calendar 4xmnBGMWJ6TVUKcAPpPb",
      "calendar lBaRbjUpEmesxEloFBME"
    ]
  },
  "named_steps": [
    {
      "name": "TRIGGER: Appointment Booked (3 consult calendars)",
      "comment": "Sole booking trigger. Must not enroll from any other calendar.",
      "does_not_write": []
    },
    {
      "name": "ADD-TAG: v2_status_booked",
      "comment": "New v2 booked tag. Must not remove or rename live booking tags.",
      "writes": [
        "v2_status_booked"
      ]
    },
    {
      "name": "EMAIL: Confirmation (native template)",
      "comment": "Sends EML | WF-03 | Confirmation.",
      "writes": [
        "email_send"
      ]
    },
    {
      "name": "SMS: Confirmation (inline)",
      "comment": "Inline confirmation SMS. Honors quiet hours 8am-9pm contact TZ.",
      "writes": [
        "sms_send"
      ]
    },
    {
      "name": "WAIT: Until T-3 days before appointment",
      "comment": "Native appointment-relative wait.",
      "writes": []
    },
    {
      "name": "SMS: Reminder T-3 days (inline)",
      "comment": "Members not patients, clinic not office.",
      "writes": [
        "sms_send"
      ]
    },
    {
      "name": "WAIT: Until T-1 day before appointment",
      "comment": "Native appointment-relative wait.",
      "writes": []
    },
    {
      "name": "EMAIL: Reminder T-1 day (native template)",
      "comment": "Sends EML | WF-03 | Reminder T-1.",
      "writes": [
        "email_send"
      ]
    },
    {
      "name": "WAIT: Until T-5 hours before appointment",
      "comment": "Same-day heads-up.",
      "writes": []
    },
    {
      "name": "SMS: Reminder T-5 hours (inline)",
      "comment": "Same-day SMS. Honors quiet hours.",
      "writes": [
        "sms_send"
      ]
    },
    {
      "name": "WAIT: Until T-2 hours before appointment",
      "comment": "Final heads-up.",
      "writes": []
    },
    {
      "name": "SMS: Reminder T-2 hours (inline)",
      "comment": "Final SMS reminder.",
      "writes": [
        "sms_send"
      ]
    },
    {
      "name": "IF-ELSE: Skip no-show branch when appt_status=reschedule",
      "comment": "Reschedule must never be marked as no-show. Guard before any no-show write.",
      "does_not_write": [
        "appt_status"
      ]
    },
    {
      "name": "ADD-TO-WF: Route to WF-04 Intake chase",
      "comment": "Hand-off to intake chase after confirmation cadence completes.",
      "writes": []
    }
  ],
  "tags_new": [
    "v2_status_booked"
  ],
  "live_tags_readonly": [
    "next-lander",
    "sms-consent"
  ]
}
