{
  "id": "wf-10",
  "name": "Feedback",
  "job": "Ask members for feedback at T+14 from WF-06. Sole writer of contact.latest_feedback_score.",
  "trigger": {
    "type": "Added from WF-06",
    "filters": ["T+14 from onboarding"],
    "notes": "Marketing window 08:00-21:00 contact TZ. Uses {{contact.current_review_link}} as an opaque string. No Google Maps."
  },
  "named_steps": [
    {
      "name": "TRIGGER: Added by WF-06 at T+14",
      "comment": "Sole enroll path. No other trigger.",
      "does_not_write": []
    },
    {
      "name": "SMS: Feedback invite (inline, first in this sequence)",
      "comment": "Inline SMS. First SMS in this sequence carries Reply STOP to opt out. Uses {{contact.current_review_link}} as a string. Marketing window 08:00-21:00 contact TZ.",
      "writes": ["sms_send"]
    },
    {
      "name": "EMAIL: Feedback invite (native template)",
      "comment": "Sends EML | WF-10 | Feedback invite. References {{contact.current_review_link}}.",
      "writes": ["email_send"]
    },
    {
      "name": "WAIT: +3 days (marketing window)",
      "comment": "Space before the nudge, marketing window aware.",
      "writes": []
    },
    {
      "name": "SMS: Feedback nudge (inline)",
      "comment": "Inline SMS. Members not patients. Marketing window 08:00-21:00 contact TZ.",
      "writes": ["sms_send"]
    },
    {
      "name": "IF-ELSE: Wait for survey submit",
      "comment": "Exits on submit. Must not fabricate a score.",
      "does_not_write": ["contact.latest_feedback_score"]
    },
    {
      "name": "SET-FIELD: contact.latest_feedback_score (sole writer)",
      "comment": "Only field this workflow writes. No other contact / opp writes.",
      "writes": ["contact.latest_feedback_score"],
      "does_not_write": ["contact.membership_status", "opportunity.pipelineStageId", "opportunity.monetaryValue"]
    },
    {
      "name": "ADD-TAG: v2_feedback_captured (audit)",
      "comment": "Audit tag only.",
      "writes": ["v2_feedback_captured"]
    }
  ],
  "tags_new": [
    "v2_feedback_captured"
  ],
  "live_tags_readonly": [
    "next-lander",
    "sms-consent"
  ]
}
