{
  "id": "wf-02",
  "name": "Non-booked Recovery",
  "job": "Non-booked recovery burst for contacts that finished WF-01 but did not book. Enrolled only via ADD-TO-WF from WF-01. Marketing / recovery: 08:00-21:00 contact TZ.",
  "trigger": {
    "type": "Added from WF-01",
    "filters": [],
    "notes": "No trigger on the shell. Enrollment is ADD-TO-WF from WF-01 only. WF-02 enforces its own funnel_entry_* exclusion inside the graph."
  },
  "named_steps": [
    {
      "name": "SMS: Non-booked +3m first touch + STOP (WF-02)",
      "comment": "Inline SMS. First SMS in the recovery burst carries Reply STOP to opt out. Send window 08:00-21:00 contact TZ (marketing).",
      "writes": ["sms_send"]
    },
    {
      "name": "WAIT: +3m before nudge 2",
      "comment": "Marketing send-window aware; 08:00-21:00 contact TZ.",
      "writes": []
    },
    {
      "name": "WAIT: +1m spacing",
      "comment": "Short spacing before nudge 2.",
      "writes": []
    },
    {
      "name": "SMS: Non-booked +1m nudge (WF-02)",
      "comment": "Inline SMS. Members not patients, clinic not office.",
      "writes": ["sms_send"]
    },
    {
      "name": "WAIT: +5m before nudge 3",
      "comment": "Send-window aware spacing.",
      "writes": []
    },
    {
      "name": "SMS: Non-booked +5m nudge (WF-02)",
      "comment": "Inline SMS.",
      "writes": ["sms_send"]
    },
    {
      "name": "WAIT: +15m before nudge 4",
      "comment": "Send-window aware spacing.",
      "writes": []
    },
    {
      "name": "SMS: Non-booked +15m nudge (WF-02)",
      "comment": "Inline SMS.",
      "writes": ["sms_send"]
    },
    {
      "name": "EMAIL: Non-booked 24h (WF-02)",
      "comment": "Sends native template EML | WF-02 | Non-booked 24h (bPj39XTcKv2HylGKEUdG).",
      "writes": ["email_send"]
    },
    {
      "name": "WAIT: +12h to reach 36h mark",
      "comment": "Bridges from the 24h email to the 36h SMS.",
      "writes": []
    },
    {
      "name": "SMS: Non-booked +36h final (WF-02)",
      "comment": "Inline SMS. Final touch before nurture hand-off.",
      "writes": ["sms_send"]
    },
    {
      "name": "ADD-TO-WF: Enroll WF-09 (long-tail nurture)",
      "comment": "ADD-TO-WF WF-09 cbc14e90-4507-42cd-afcc-f7410d7f4554. Must not touch renewal_date; only WF-09 owns that trigger.",
      "writes": []
    }
  ],
  "tags_new": [],
  "live_tags_readonly": [
    "next-lander",
    "funnel_entry_*",
    "sms-consent"
  ]
}
